{
  "profileId": "spotcomp-proof-tree-irresolution-candidate",
  "recursionBase": {
    "tokenPrimitive": true,
    "claimPrimitive": true,
    "utteranceOrderedPair": true,
    "articulatingRecursivePair": true,
    "finiteInstancesBottomOutAtPrimitives": true,
    "externalPresentationRequiresUtterance": true,
    "evidence": [
      "PROOF-TREE-IRRESOLUTION.md#1-recursion-and-bottoming-out",
      "PRELOCUTIONARY-INGRESS.md#1-primitive-boundary"
    ]
  },
  "stagePreservation": {
    "articulatingAperiodic": true,
    "predicatingTransfinite": true,
    "positingScottContinuous": true,
    "settlingFinite": true,
    "noCrossRegimeShortcut": true,
    "boundedPrefixNotFinalSettlement": true,
    "evidence": [
      "PROOF-TREE-IRRESOLUTION.md#2-stage-preservation",
      "PREDICATION-STAGES.md"
    ]
  },
  "partialFunctionBoundary": {
    "partialMapSupportDeclared": true,
    "outsideSupportDefaultDeclared": true,
    "bottomExtensionDisciplineDeclared": true,
    "obstructionEvidencePreserved": true,
    "hostNullNotProofTreeResult": true,
    "hostExceptionNotProofTreeResult": true,
    "evidence": [
      "PROOF-TREE-IRRESOLUTION.md#3-partial-functions-and-bottom-extensions",
      "PREDICATION-FIBER-ALGEBRA.md",
      "REALIZABILITY-DEFORMATION.md"
    ]
  },
  "closureBoundary": {
    "closureMonadDeclared": true,
    "settlingOrbitDeclared": true,
    "fixedPointEvidenceRequiredForFinal": true,
    "trajectoryPrefixAllowedWhenNonFinal": true,
    "obstructionOrCohomologyAuditAllowed": true,
    "downgradeRequiredWithoutEvidence": true,
    "boundedExecutionNotSettlement": true,
    "evidence": [
      "PROOF-TREE-IRRESOLUTION.md#4-closure-prefixes-and-apex",
      "CLOSURE-SETTLING.md",
      "COHOMOLOGY-AUDIT.md"
    ]
  },
  "trcTdpBoundary": {
    "schemasAsTypeWitnesses": true,
    "logsAsTraceEvidence": true,
    "scriptsAsMorphismWitnesses": true,
    "dualFilingAnchorsEvidence": true,
    "replayFromTraceRequired": true,
    "closureExecutionAsProgram": true,
    "unresolvedCasesRemainReplayable": true,
    "evidence": [
      "PROOF-TREE-IRRESOLUTION.md#5-trctdp-as-executable-proof-tree",
      "library/trc-tdp/specification.md",
      "TRC-LAYOUT.md"
    ]
  },
  "outsideSystemBoundary": {
    "outsideSystemsPresentOnly": true,
    "llmCompletionNotSettlement": true,
    "modeledPlayerEvidenceRequired": true,
    "generatedClaimRequiresAdmission": true,
    "toolCallRequiresTypedLocution": true,
    "stageClaimsRequireStageEvidence": true,
    "evidence": [
      "PROOF-TREE-IRRESOLUTION.md#6-io-and-outside-systems",
      "IO-ARTICULATION.md",
      "MODELED-PLAYERS.md"
    ]
  },
  "standardsBoundary": {
    "objectBoundaryBeforeStandards": true,
    "jsonOnlyCarrierConstraint": true,
    "signatureOnlyAuthenticatesCarrier": true,
    "httpDoesNotChangeStage": true,
    "mediaTypeBindsDerivedObject": true,
    "problemDetailsCanReportNonFinalBoundary": true,
    "evidence": [
      "PROOF-TREE-IRRESOLUTION.md#7-standards-consequence",
      "IETF-CONFORMANCE.md",
      "WIRE-PROFILES.md"
    ]
  },
  "implementationBoundary": {
    "noTotalFunctionShortcut": true,
    "noSilentDefaultAsResolution": true,
    "noHostExceptionAsMathematicalFailure": true,
    "noParserAsProofEngine": true,
    "noEndpointStateAsHistory": true,
    "codeRemainsProbe": true,
    "evidence": [
      "PROOF-TREE-IRRESOLUTION.md#8-declaration-probe",
      "IMPLEMENTATION.md"
    ]
  },
  "evidence": [
    "PROOF-TREE-IRRESOLUTION.md",
    "development/active/docs/dev/journal/2026-05-27.md",
    "development/active/docs/dev/journal/2026-05-28.md",
    "development/active/library/utterance/docs/dev/journal/2026-05-25.md",
    "development/active/articulating/articulating.schema.json"
  ]
}
